{
  "$schema": "https://json-schema.org/draft/2020-12/schema",
  "$id": "https://echoforge.local/schemas/detector_graph.schema.json",
  "title": "detector_graph",
  "description": "EchoForge detector_graph document. Describes a signal-processing / detection pipeline as a directed graph of named nodes and edge specs (currently encoded as opaque strings; v2 will move to structured node and edge records). Conforms to the EchoForge strict-open contract: deterministic ids, explicit provenance, license, and validation envelope.",
  "type": "object",
  "additionalProperties": false,
  "required": [
    "id",
    "kind",
    "schema_version",
    "public_proxy_id",
    "provenance",
    "license",
    "validation",
    "graph_name",
    "nodes",
    "edges"
  ],
  "properties": {
    "id": {
      "description": "Deterministic EchoForge id of the form ef:<kind>:<public_proxy_id>:<16hex>:1, computed from the identity field tuple.",
      "$ref": "https://echoforge.local/schemas/common.schema.json#/$defs/deterministic_id"
    },
    "kind": {
      "description": "Document kind discriminator; must be the literal string \"detector_graph\".",
      "const": "detector_graph"
    },
    "schema_version": {
      "description": "Schema contract version this document conforms to (currently pinned to 1.0.0).",
      "$ref": "https://echoforge.local/schemas/common.schema.json#/$defs/schema_version"
    },
    "public_proxy_id": {
      "description": "Slug identifying the public proxy this detector graph is derived from (lowercase, dot/underscore/hyphen separated).",
      "$ref": "https://echoforge.local/schemas/common.schema.json#/$defs/slug"
    },
    "provenance": {
      "description": "Provenance envelope: source kind, source references, generator, timestamp, and payload fingerprint.",
      "$ref": "https://echoforge.local/schemas/common.schema.json#/$defs/provenance"
    },
    "license": {
      "description": "License envelope (SPDX id and optional notice) governing use of this document.",
      "$ref": "https://echoforge.local/schemas/common.schema.json#/$defs/license"
    },
    "validation": {
      "description": "Validation envelope: tier, overall status, uncertainty score, and per-check results.",
      "$ref": "https://echoforge.local/schemas/common.schema.json#/$defs/validation"
    },
    "graph_name": {
      "description": "Human-readable name of the detector graph (e.g. \"cfar_then_dbscan_v1\"); non-empty string.",
      "type": "string",
      "minLength": 1
    },
    "nodes": {
      "description": "Ordered node ids that make up the graph; structured node spec TBD in v2. At least one node required.",
      "type": "array",
      "minItems": 1,
      "items": {
        "type": "string",
        "minLength": 1
      }
    },
    "edges": {
      "description": "Edge specs encoded as strings (e.g. \"src_node->dst_node\"); v2 will move to structured edge records. May be empty.",
      "type": "array",
      "items": {
        "type": "string",
        "minLength": 1
      }
    }
  }
}
